(detect128) kola@Kola-AMD-PC:~/sources/github/kolabit/detect128$ ./convert.sh
fatal: destination path 'VectorBlox-SDK' already exists and is not an empty directory.

export VBX_SDK=/home/kola/sources/github/kolabit/detect128/VectorBlox-SDK

VBX Python Environment ready. Activating...
To deactivate VBX Python Environment, run 'deactivate'
Checking and activating VBX Python Environment...
STEP 1: Export to tflite int8
Ultralytics 8.3.72 🚀 Python-3.11.14 torch-2.3.0+cu121 CPU (AMD Ryzen 9 5950X 16-Core Processor)
WARNING ⚠️ INT8 export requires a missing 'data' arg for calibration. Using default 'data=coco8.yaml'.
Model summary (fused): 168 layers, 11,125,971 parameters, 0 gradients, 28.4 GFLOPs

PyTorch: starting from 'detect128.pt' with input shape (1, 3, 640, 640) BCHW and output shape(s) (1, 5, 8400) (21.5 MB)

TensorFlow SavedModel: starting export with tensorflow 2.15.1...

ONNX: starting export with onnx 1.16.1 opset 17...
ONNX: slimming with onnxslim 0.1.32...
ONNX: export success ✅ 1.4s, saved as 'detect128.onnx' (42.8 MB)
TensorFlow SavedModel: collecting INT8 calibration images from 'data=coco8.yaml'
Scanning /home/kola/sources/github/kolabit/detect128/datasets/coco8/labels/val.cache... 4 images, 0 backgrounds, 0 corrupt: 100%|██████████| 4/4 [00:00<?, ?it/s]
TensorFlow SavedModel: WARNING ⚠️ >300 images recommended for INT8 calibration, found 4 images.
TensorFlow SavedModel: starting TFLite export with onnx2tf 1.22.3...
Summary on the non-converted ops:
---------------------------------
 * Accepted dialects: tfl, builtin, func
 * Non-Converted Ops: 155, Total Ops 410, % non-converted = 37.80 %
 * 155 ARITH ops

- arith.constant:  155 occurrences  (f32: 131, i32: 24)



  (f32: 8)
  (f32: 18)
  (f32: 64)
  (f32: 58)
  (f32: 3)
  (f32: 59)
  (f32: 7)
  (f32: 6)
  (f32: 2)
  (f32: 1)
  (f32: 20)
  (f32: 2)
  (f32: 4)
Summary on the non-converted ops:
---------------------------------
 * Accepted dialects: tfl, builtin, func
 * Non-Converted Ops: 155, Total Ops 541, % non-converted = 28.65 %
 * 155 ARITH ops

- arith.constant:  155 occurrences  (f16: 131, i32: 24)



  (f32: 8)
  (f32: 18)
  (f32: 64)
  (f32: 131)
  (f32: 58)
  (f32: 3)
  (f32: 59)
  (f32: 7)
  (f32: 6)
  (f32: 2)
  (f32: 1)
  (f32: 20)
  (f32: 2)
  (f32: 4)
Summary on the non-converted ops:
---------------------------------
 * Accepted dialects: tfl, builtin, func
 * Non-Converted Ops: 96, Total Ops 410, % non-converted = 23.41 %
 * 96 ARITH ops

- arith.constant:   96 occurrences  (f32: 72, i32: 24)



  (f32: 8)
  (f32: 18)
  (f32: 64)
  (f32: 58)
  (f32: 3)
  (f32: 59)
  (f32: 7)
  (uq_8: 59)
  (f32: 6)
  (f32: 2)
  (f32: 1)
  (f32: 20)
  (f32: 2)
  (f32: 4)
Summary on the non-converted ops:
---------------------------------
 * Accepted dialects: tfl, builtin, func
 * Non-Converted Ops: 155, Total Ops 410, % non-converted = 37.80 %
 * 155 ARITH ops

- arith.constant:  155 occurrences  (f32: 131, i32: 24)



  (f32: 8)
  (f32: 18)
  (f32: 64)
  (f32: 58)
  (f32: 3)
  (f32: 59)
  (f32: 7)
  (f32: 6)
  (f32: 2)
  (f32: 1)
  (f32: 20)
  (f32: 2)
  (f32: 4)
fully_quantize: 0, inference_type: 6, input_inference_type: FLOAT32, output_inference_type: FLOAT32
Summary on the non-converted ops:
---------------------------------
 * Accepted dialects: tfl, builtin, func
 * Non-Converted Ops: 155, Total Ops 410, % non-converted = 37.80 %
 * 155 ARITH ops

- arith.constant:  155 occurrences  (f32: 131, i32: 24)



  (f32: 8)
  (f32: 18)
  (f32: 64)
  (f32: 58)
  (f32: 3)
  (f32: 59)
  (f32: 7)
  (f32: 6)
  (f32: 2)
  (f32: 1)
  (f32: 20)
  (f32: 2)
  (f32: 4)
fully_quantize: 0, inference_type: 6, input_inference_type: INT8, output_inference_type: INT8
Summary on the non-converted ops:
---------------------------------
 * Accepted dialects: tfl, builtin, func
 * Non-Converted Ops: 155, Total Ops 410, % non-converted = 37.80 %
 * 155 ARITH ops

- arith.constant:  155 occurrences  (f32: 131, i32: 24)



  (f32: 8)
  (f32: 18)
  (f32: 64)
  (f32: 58)
  (f32: 3)
  (f32: 59)
  (f32: 7)
  (f32: 6)
  (f32: 2)
  (f32: 1)
  (f32: 20)
  (f32: 2)
  (f32: 4)
Summary on the non-converted ops:
---------------------------------
 * Accepted dialects: tfl, builtin, func
 * Non-Converted Ops: 155, Total Ops 410, % non-converted = 37.80 %
 * 155 ARITH ops

- arith.constant:  155 occurrences  (f32: 131, i32: 24)



  (f32: 8)
  (f32: 18)
  (f32: 64)
  (f32: 58)
  (f32: 3)
  (f32: 59)
  (f32: 7)
  (f32: 6)
  (f32: 2)
  (f32: 1)
  (f32: 20)
  (f32: 2)
  (f32: 4)
TensorFlow SavedModel: export success ✅ 79.2s, saved as 'detect128_saved_model' (139.9 MB)

TensorFlow Lite: starting export with tensorflow 2.15.1...
TensorFlow Lite: export success ✅ 0.0s, saved as 'detect128_saved_model/detect128_int8.tflite' (10.9 MB)

Export complete (79.5s)
Results saved to /home/kola/sources/github/kolabit/detect128/data/model
Predict:         yolo predict task=detect model=detect128_saved_model/detect128_int8.tflite imgsz=640 int8
Validate:        yolo val task=detect model=detect128_saved_model/detect128_int8.tflite imgsz=640 data=/home/kola/sources/github/kolabit/detect128/conf/data.yaml int8
Visualize:       https://netron.app
💡 Learn more at https://docs.ultralytics.com/modes/export
STEP 2: Cutting graph
STEP 3: Generating VNNX for V1000 configuration...
INFO: Created TensorFlow Lite XNNPACK delegate for CPU.
100%|████████████████████████████████████████████████████████████████████████████████████████████████████████████████████████████████████████████████████████████████| 123/123 [00:06<00:00, 19.81it/s]
Running Simulation...
Saved simulation result to output.png
(detect128) kola@Kola-AMD-PC:~/sources/github/kolabit/detect128$
